id,user_id,gerado_por_id,nota_geral,resumo,pontos_fortes,areas_desenvolvimento,recomendacoes,proximos_passos,metricas,criado_em
1,21,21,6.50,"O vendedor Administrador iniciou seu processo de treinamento com uma boa performance no quiz inicial, mostrando compreensão dos fundamentos básicos do crédito consignado. No entanto, ainda está no início da jornada, com baixa conclusão das lições e nenhuma avaliação formal nas simulações de atendimento. O uso do gerador de abordagens está presente, indicando alguma preparação para o contato com clientes.","[""Aprovação rápida e eficiente no quiz inicial"", ""Participação regular nas sessões de roleplay"", ""Uso ativo do gerador de abordagens"", ""Foco inicial em clientes novo servidor, público relevante"", ""Boa motivação para iniciar o treinamento""]","[""Aumentar a frequência e regularidade do estudo das lições"", ""Buscar avaliações formais nas simulações para medir a evolução"", ""Expandir a variedade de tipos de clientes abordados"", ""Diversificar os canais de abordagem além do WhatsApp"", ""Completar mais lições para alcançar pelo menos 50% de conclusão""]","[""Estabelecer uma rotina de estudos com pelo menos 3 sessões semanais para avançar nas lições"", ""Solicitar feedback formal após as próximas simulações de roleplay para identificar pontos de melhoria"", ""Experimentar abordagens em outros canais como telefone ou e-mail para ampliar habilidades"", ""Incluir clientes de perfis variados nas abordagens para ganhar experiência diversificada"", ""Priorizar a conclusão das lições fundamentais para consolidar o conhecimento""]","[""Focar no aumento da frequência dos treinos e na conclusão das lições pendentes. Iniciar avaliações formais nas simulações para monitorar a qualidade do atendimento e alinhar os feedbacks recebidos com as ações de desenvolvimento. Expandir o uso de canais e tipos de clientes abordados para uma preparação mais completa.""]","{""quiz"": {""aprovacoes"": 1, ""taxaAprovacao"": ""100.0"", ""totalTentativas"": 1}, ""roleplay"": {""mediaVenda"": ""0.00"", ""totalSessoes"": 4, ""mediaConsultivo"": ""0.00"", ""mediaNotaGlobal"": ""0.00"", ""totalAvaliacoes"": 0, ""mediaHumanizacao"": ""0.00"", ""sessoesUltimos30Dias"": 4, ""pontosFortesMaisFrequentes"": [], ""pontosMelhorarMaisFrequentes"": []}, ""vendedor"": {""nome"": ""Administrador"", ""dataInicio"": ""2025-12-11T15:05:56.790Z"", ""nivelAtual"": 1, ""quizAprovado"": true, ""notaMediaGlobal"": null, ""totalSimulacoes"": 0, ""dataAprovacaoQuiz"": ""2025-12-11T16:29:21.169Z""}, ""abordagens"": {""canaisUsados"": {""whatsapp"": 3}, ""totalGeradas"": 3, ""tiposClienteAbordados"": {""novo_servidor"": 3}, ""abordagensUltimos30Dias"": 3}, ""fundamentos"": {""totalLicoes"": 25, ""licoesConcluidas"": 5, ""percentualConclusao"": ""20.0""}}",2025-12-11 23:18:23.244147
2,21,21,7.00,"O vendedor Administrador demonstra um bom início no treinamento, com aprovação no quiz fundamental e consistência nas sessões de roleplay. Embora mostre interesse e empenho, especialmente na oferta de opções e explicação da amortização, ainda apresenta oportunidades claras para aprimorar a empatia e a abordagem consultiva durante as simulações.","[""Aprovou o quiz fundamental na primeira tentativa com 100% de acertos."", ""Mantém boa frequência nas sessões práticas de roleplay."", ""Apresenta múltiplas opções de pagamento aos clientes."", ""Demonstra interesse genuíno em ajudar durante as simulações."", ""Explica estratégias de amortização de forma clara.""]","[""Aumentar a empatia e o acolhimento nas interações com o cliente."", ""Focar mais nas preocupações e necessidades do cliente antes de apresentar soluções."", ""Fazer perguntas mais abertas para explorar melhor o cenário do cliente."", ""Explicar o produto de forma mais detalhada antes de discutir taxas."", ""Avançar com maior dedicação na conclusão dos fundamentos teóricos.""]","[""Incorporar técnicas de escuta ativa para entender melhor as necessidades do cliente durante o roleplay."", ""Praticar perguntas abertas nas próximas simulações para obter informações mais completas."", ""Antes de apresentar taxas, dedicar tempo para explicar detalhadamente o produto e seus benefícios."", ""Reservar horários fixos durante a semana para avançar nos fundamentos, buscando aumentar para pelo menos 50% de conclusão nas próximas semanas."", ""Utilizar feedbacks das simulações para melhorar a humanização e a abordagem consultiva.""]","[""Priorizar o avanço nos fundamentos teóricos para consolidar o conhecimento base, enquanto trabalha em roleplays focados em empatia e exploração das necessidades do cliente. Reforçar o treinamento prático com foco em perguntas abertas e explicação clara do produto antes de discutir condições financeiras.""]","{""quiz"": {""aprovacoes"": 1, ""taxaAprovacao"": ""100.0"", ""totalTentativas"": 1}, ""roleplay"": {""mediaVenda"": ""6.50"", ""totalSessoes"": 6, ""mediaConsultivo"": ""6.00"", ""mediaNotaGlobal"": ""6.75"", ""totalAvaliacoes"": 2, ""mediaHumanizacao"": ""6.00"", ""sessoesUltimos30Dias"": 6, ""pontosFortesMaisFrequentes"": [{""count"": 1, ""ponto"": ""Apresentou várias opções de pagamento.""}, {""count"": 1, ""ponto"": ""Tentou explicar a estratégia de amortização.""}, {""count"": 1, ""ponto"": ""Demonstrou interesse em ajudar""}], ""pontosMelhorarMaisFrequentes"": [{""count"": 1, ""ponto"": ""Focar mais nas preocupações do cliente e explorar suas necessidades antes de apresentar soluções.""}, {""count"": 1, ""ponto"": ""Aumentar a empatia nas respostas, buscando entender melhor a situação do cliente.""}, {""count"": 1, ""ponto"": ""Focar em explicar o produto antes de perguntar sobre taxas""}, {""count"": 1, ""ponto"": ""Fazer perguntas mais abertas para entender o cenário do cliente""}, {""count"": 1, ""ponto"": ""Mostrar mais empatia e acolhimento""}]}, ""vendedor"": {""nome"": ""Administrador"", ""dataInicio"": ""2025-12-11T15:05:56.790Z"", ""nivelAtual"": 1, ""quizAprovado"": true, ""notaMediaGlobal"": ""6.75"", ""totalSimulacoes"": 2, ""dataAprovacaoQuiz"": ""2025-12-11T16:29:21.169Z""}, ""abordagens"": {""canaisUsados"": {""whatsapp"": 3}, ""totalGeradas"": 3, ""tiposClienteAbordados"": {""novo_servidor"": 3}, ""abordagensUltimos30Dias"": 3}, ""fundamentos"": {""totalLicoes"": 25, ""licoesConcluidas"": 5, ""percentualConclusao"": ""20.0""}}",2025-12-11 23:55:05.753317
3,21,21,7.00,"O vendedor Administrador demonstra um bom início no treinamento com aprovação no quiz de fundamentos e engajamento consistente nas simulações de atendimento. Embora a nota média das avaliações roleplay esteja próxima do esperado, há espaço claro para aprimorar a empatia e o entendimento das necessidades do cliente. O uso do gerador de abordagens mostra iniciativa, especialmente focando em novos servidores via WhatsApp, mas a conclusão dos fundamentos ainda está baixa, indicando necessidade de maior dedicação aos conteúdos teóricos.","[""Aprovação imediata no quiz de fundamentos."", ""Constância e frequência nas simulações de atendimento."", ""Apresentação de várias opções de pagamento durante o atendimento."", ""Tentativa de explicar estratégias financeiras ao cliente."", ""Demonstra interesse genuíno em ajudar o cliente.""]","[""Aumentar a empatia e acolhimento nas interações com clientes."", ""Focar mais nas preocupações e necessidades do cliente antes de ofertar soluções."", ""Realizar perguntas abertas para melhor compreensão do cenário do cliente."", ""Explicar o produto de forma clara antes de abordar questões sobre taxas."", ""Avançar na conclusão das lições dos fundamentos para consolidar conhecimento.""]","[""Dedicar tempo diário para avançar nas lições de fundamentos, visando aumentar o percentual de conclusão."", ""Praticar técnicas de escuta ativa e empatia em roleplays, utilizando perguntas abertas para explorar necessidades do cliente."", ""Revisar os atendimentos gravados focando em como demonstrar acolhimento e humanização."", ""Diversificar abordagens e explorar outros canais além do WhatsApp para ampliar alcance e experiência."", ""Solicitar feedbacks específicos após cada simulação para identificar melhorias imediatas e ajustar posturas.""]","[""Priorizar a conclusão dos conteúdos teóricos dos fundamentos para consolidar base técnica, enquanto continua praticando roleplays focados em empatia e exploração das necessidades do cliente. Paralelamente, ampliar o uso do gerador de abordagens para outros perfis e canais, buscando maior versatilidade no atendimento.""]","{""quiz"": {""aprovacoes"": 1, ""taxaAprovacao"": ""100.0"", ""totalTentativas"": 1}, ""roleplay"": {""mediaVenda"": ""6.50"", ""totalSessoes"": 6, ""mediaConsultivo"": ""6.00"", ""mediaNotaGlobal"": ""6.75"", ""totalAvaliacoes"": 2, ""mediaHumanizacao"": ""6.00"", ""sessoesUltimos30Dias"": 6, ""pontosFortesMaisFrequentes"": [{""count"": 1, ""ponto"": ""Apresentou várias opções de pagamento.""}, {""count"": 1, ""ponto"": ""Tentou explicar a estratégia de amortização.""}, {""count"": 1, ""ponto"": ""Demonstrou interesse em ajudar""}], ""pontosMelhorarMaisFrequentes"": [{""count"": 1, ""ponto"": ""Focar mais nas preocupações do cliente e explorar suas necessidades antes de apresentar soluções.""}, {""count"": 1, ""ponto"": ""Aumentar a empatia nas respostas, buscando entender melhor a situação do cliente.""}, {""count"": 1, ""ponto"": ""Focar em explicar o produto antes de perguntar sobre taxas""}, {""count"": 1, ""ponto"": ""Fazer perguntas mais abertas para entender o cenário do cliente""}, {""count"": 1, ""ponto"": ""Mostrar mais empatia e acolhimento""}]}, ""vendedor"": {""nome"": ""Administrador"", ""dataInicio"": ""2025-12-11T15:05:56.790Z"", ""nivelAtual"": 1, ""quizAprovado"": true, ""notaMediaGlobal"": ""6.75"", ""totalSimulacoes"": 2, ""dataAprovacaoQuiz"": ""2025-12-11T16:29:21.169Z""}, ""abordagens"": {""canaisUsados"": {""whatsapp"": 3}, ""totalGeradas"": 3, ""tiposClienteAbordados"": {""novo_servidor"": 3}, ""abordagensUltimos30Dias"": 3}, ""fundamentos"": {""totalLicoes"": 25, ""licoesConcluidas"": 5, ""percentualConclusao"": ""20.0""}}",2025-12-12 13:51:22.466208
4,30,21,3.00,"O vendedor 'Coordenador' está em fase inicial de treinamento e ainda não iniciou atividades práticas como quizzes, simulações de atendimento (roleplays) ou geração de abordagens. Não há registros de lições concluídas ou avaliações realizadas até o momento, o que indica que o processo de capacitação ainda não foi efetivamente iniciado.","[""Disponibilidade para iniciar o treinamento (nível 1)"", ""Potencial para desenvolver habilidades com apoio adequado"", ""Possibilidade de acompanhamento próximo pelo gestor para acelerar evolução""]","[""Iniciar e manter uma rotina consistente de treinamentos semanais"", ""Participar ativamente dos quizzes para fixação dos fundamentos"", ""Realizar simulações de atendimento para ganhar prática e confiança"", ""Utilizar regularmente o gerador de abordagens para preparar atendimentos"", ""Concluir as lições disponíveis para ampliar o conhecimento teórico""]","[""Definir um cronograma de treinamentos com metas semanais claras, visando pelo menos 3 sessões semanais"", ""Incentivar o vendedor a realizar o primeiro quiz o mais breve possível para avaliar o conhecimento inicial"", ""Agendar sessões de roleplay supervisionadas para estimular a prática e receber feedback"", ""Orientar o uso do gerador de abordagens antes das simulações para melhorar a comunicação"", ""Monitorar o progresso das lições concluídas e estimular a conclusão das 25 lições fundamentais""]","[""Priorizar o início imediato dos treinamentos teóricos e práticos, começando pelas lições e quizzes. Agendar roleplays regulares para acelerar a evolução nas habilidades de atendimento e vendas. Implementar acompanhamento semanal para garantir a adesão ao plano de desenvolvimento.""]","{""quiz"": {""aprovacoes"": 0, ""taxaAprovacao"": ""0.0"", ""totalTentativas"": 0}, ""roleplay"": {""mediaVenda"": ""0.00"", ""totalSessoes"": 0, ""mediaConsultivo"": ""0.00"", ""mediaNotaGlobal"": ""0.00"", ""totalAvaliacoes"": 0, ""mediaHumanizacao"": ""0.00"", ""sessoesUltimos30Dias"": 0, ""pontosFortesMaisFrequentes"": [], ""pontosMelhorarMaisFrequentes"": []}, ""vendedor"": {""nome"": ""Coordenador"", ""dataInicio"": ""2025-12-13T00:19:00.188Z"", ""nivelAtual"": 1, ""quizAprovado"": false, ""notaMediaGlobal"": null, ""totalSimulacoes"": 0, ""dataAprovacaoQuiz"": null}, ""abordagens"": {""canaisUsados"": {}, ""totalGeradas"": 0, ""tiposClienteAbordados"": {}, ""abordagensUltimos30Dias"": 0}, ""fundamentos"": {""totalLicoes"": 25, ""licoesConcluidas"": 0, ""percentualConclusao"": ""0.0""}}",2025-12-16 14:05:12.290049
5,21,21,5.50,"O vendedor Administrador mostra um bom início de jornada, com aprovação rápida no quiz de fundamentos e participação ativa em simulações recentes. Contudo, o desempenho nas simulações ainda está abaixo do esperado para o nível atual, indicando necessidade de foco em habilidades de atendimento e empatia. A geração de abordagens está presente, mas pode ser ampliada para maior preparação.","[""Apresentação de várias opções de pagamento ao cliente"", ""Tentativa de explicar a estratégia de amortização"", ""Demonstração de interesse em ajudar o cliente""]","[""Focar mais nas preocupações e necessidades do cliente antes de apresentar soluções"", ""Aumentar a empatia e acolhimento durante o atendimento"", ""Explicar o produto de forma clara antes de abordar questões sobre taxas"", ""Fazer perguntas abertas para entender melhor o cenário do cliente"", ""Equilibrar estudos teóricos com prática para melhorar o conhecimento dos fundamentos""]","[""Incentivar o Administrador a concluir mais lições dos fundamentos para fortalecer o embasamento teórico"", ""Realizar roleplays focados em empatia e escuta ativa, utilizando perguntas abertas para aprofundar o conhecimento das necessidades do cliente"", ""Ampliar o uso do gerador de abordagens para diferentes tipos de clientes e canais, estimulando a preparação para diversos cenários"", ""Treinar a explicação clara e sequencial do produto antes de discutir taxas e condições financeiras"", ""Solicitar feedback detalhado após cada roleplay para identificar pontos específicos de melhoria e monitorar evolução""]","[""Priorizar a conclusão das lições de fundamentos para solidificar conhecimentos teóricos, enquanto mantém a frequência de roleplays com foco em empatia e atendimento consultivo. Incentivar o aumento da geração de abordagens em diferentes canais e perfis de clientes para ampliar a prática e a confiança nos atendimentos.""]","{""quiz"": {""aprovacoes"": 1, ""taxaAprovacao"": ""100.0"", ""totalTentativas"": 1}, ""roleplay"": {""mediaVenda"": ""6.50"", ""totalSessoes"": 8, ""mediaConsultivo"": ""6.00"", ""mediaNotaGlobal"": ""3.38"", ""totalAvaliacoes"": 4, ""mediaHumanizacao"": ""6.00"", ""sessoesUltimos30Dias"": 8, ""pontosFortesMaisFrequentes"": [{""count"": 1, ""ponto"": ""Apresentou várias opções de pagamento.""}, {""count"": 1, ""ponto"": ""Tentou explicar a estratégia de amortização.""}, {""count"": 1, ""ponto"": ""Demonstrou interesse em ajudar""}], ""pontosMelhorarMaisFrequentes"": [{""count"": 1, ""ponto"": ""Focar mais nas preocupações do cliente e explorar suas necessidades antes de apresentar soluções.""}, {""count"": 1, ""ponto"": ""Aumentar a empatia nas respostas, buscando entender melhor a situação do cliente.""}, {""count"": 1, ""ponto"": ""Focar em explicar o produto antes de perguntar sobre taxas""}, {""count"": 1, ""ponto"": ""Fazer perguntas mais abertas para entender o cenário do cliente""}, {""count"": 1, ""ponto"": ""Mostrar mais empatia e acolhimento""}]}, ""vendedor"": {""nome"": ""Administrador"", ""dataInicio"": ""2025-12-11T15:05:56.790Z"", ""nivelAtual"": 1, ""quizAprovado"": true, ""notaMediaGlobal"": ""3.38"", ""totalSimulacoes"": 4, ""dataAprovacaoQuiz"": ""2025-12-11T16:29:21.169Z""}, ""abordagens"": {""canaisUsados"": {""whatsapp"": 3}, ""totalGeradas"": 3, ""tiposClienteAbordados"": {""novo_servidor"": 3}, ""abordagensUltimos30Dias"": 3}, ""fundamentos"": {""totalLicoes"": 25, ""licoesConcluidas"": 5, ""percentualConclusao"": ""20.0""}}",2025-12-16 14:05:23.588087
6,30,30,8.50,"O vendedor Coordenador está iniciando sua jornada de treinamento com uma participação inicial positiva em simulações de atendimento, demonstrando empatia e esforço para esclarecer dúvidas, embora ainda precise avançar significativamente nos estudos teóricos e na prática de vendas.","[""Empatia nas respostas durante as simulações"", ""Esforço para esclarecer dúvidas complexas sobre taxas"", ""Uso regular do gerador de abordagens para diferentes perfis de clientes"", ""Boa humanização no atendimento"", ""Iniciativa em abordar clientes negativados""]","[""Aumentar a frequência e consistência dos treinamentos, incluindo quizzes e lições teóricas"", ""Melhorar a objetividade e assertividade nas respostas durante o atendimento"", ""Aprimorar a abordagem sobre o conforto e flexibilidade das parcelas para o cliente"", ""Focar no desenvolvimento da habilidade de fechamento de vendas para elevar a nota de venda"", ""Concluir as lições de fundamentos para solidificar o conhecimento técnico""]","[""Estabelecer uma rotina mínima de treinos, visando ao menos 3 sessões semanais, incluindo quizzes e roleplays"", ""Realizar o primeiro quiz o quanto antes para começar a validar o conhecimento adquirido"", ""Praticar simulações focadas em técnicas de fechamento e explicação clara das vantagens do produto"", ""Utilizar feedbacks das simulações para ser mais direto e objetivo nas respostas"", ""Explorar as lições teóricas para avançar no conhecimento dos fundamentos do crédito consignado""]","[""Priorizar a realização de quizzes e o avanço nas lições teóricas para fortalecer a base de conhecimento, enquanto aumenta gradativamente a frequência das simulações focando na melhoria das técnicas de venda e abordagem objetiva.""]","{""quiz"": {""aprovacoes"": 0, ""taxaAprovacao"": ""0.0"", ""totalTentativas"": 0}, ""roleplay"": {""mediaVenda"": ""6.00"", ""totalSessoes"": 1, ""mediaConsultivo"": ""7.00"", ""mediaNotaGlobal"": ""7.50"", ""totalAvaliacoes"": 1, ""mediaHumanizacao"": ""8.00"", ""sessoesUltimos30Dias"": 1, ""pontosFortesMaisFrequentes"": [{""count"": 1, ""ponto"": ""Empatia nas respostas""}, {""count"": 1, ""ponto"": ""Tentativa de esclarecer dúvidas sobre taxas""}], ""pontosMelhorarMaisFrequentes"": [{""count"": 1, ""ponto"": ""Ser mais direto nas respostas""}, {""count"": 1, ""ponto"": ""Abordar melhor a questão do conforto das parcelas""}]}, ""vendedor"": {""nome"": ""Coordenador"", ""dataInicio"": ""2025-12-13T00:19:00.188Z"", ""nivelAtual"": 1, ""quizAprovado"": false, ""notaMediaGlobal"": ""7.50"", ""totalSimulacoes"": 1, ""dataAprovacaoQuiz"": null}, ""abordagens"": {""canaisUsados"": {""whatsapp"": 6}, ""totalGeradas"": 6, ""tiposClienteAbordados"": {""novo_servidor"": 1, ""cliente_antigo"": 1, ""cliente_negativado"": 4}, ""abordagensUltimos30Dias"": 6}, ""fundamentos"": {""totalLicoes"": 25, ""licoesConcluidas"": 0, ""percentualConclusao"": ""0.0""}}",2025-12-16 14:30:49.730849
